{
  "schema_version": "1.0.0",
  "request_id": "request_001",
  "discovery_table_sha256": "bbbbbbbbbbbbbbbbbbbbbbbbbbbbbbbbbbbbbbbbbbbbbbbbbbbbbbbbbbbbbbbb",
  "transformation_sha256": "dddddddddddddddddddddddddddddddddddddddddddddddddddddddddddddddd",
  "discovery_units_sha256": "eeeeeeeeeeeeeeeeeeeeeeeeeeeeeeeeeeeeeeeeeeeeeeeeeeeeeeeeeeeeeeee",
  "partition_claim": {
    "claim_id": "claim_001",
    "claim_sha256": "1111111111111111111111111111111111111111111111111111111111111111",
    "total_units": 20,
    "discovery_units": 12,
    "confirmation_units": 8,
    "declared_disjoint": true,
    "declared_exhaustive": true
  },
  "unit_declaration": {
    "column": "u_001",
    "basis": "declared_assignment_unit",
    "evidence_ref": "evidence_001"
  },
  "seed": 20260812,
  "split_algorithm": "sha256_cluster_v1",
  "candidate_enumeration_policy": "lexical_complete_before_budget",
  "candidate_budget": 100,
  "common_cohort_policy": "intersection_before_scoring",
  "equivalence_tolerance": 0.1,
  "detection_floor": 0.05,
  "learner_families": ["kernel", "linear"],
  "isolation_claim": {
    "source_url": "unavailable",
    "study_title": "unavailable",
    "file_names": "unavailable",
    "codebook_labels": "unavailable",
    "paper": "unavailable",
    "replication_scripts": "unavailable",
    "published_results": "unavailable",
    "confirmation_outcomes": "unavailable",
    "oracle": "unavailable",
    "network": "unavailable"
  }
}
